{
  "id": "ms-de-ro-die-unterstuetzung",
  "parent": "ms-ro-sprijin-d587c168@ddb25eb90622abd4a1d8c3e7a6ffc01f",
  "part_of_speech": "noun",
  "tags": [
    "level:b1",
    "etymology:slavic",
    "topic:people-society",
    "register:neutral",
    "property:abstract"
  ],
  "sourceLanguage": "de",
  "targetLanguage": "ro",
  "metadata": {
    "author": "mschwehl",
    "source": "swipedict-de-ro",
    "contentVersion": 5,
    "schemaVersion": "1.0"
  },
  "source": {
    "lang": "de",
    "headword": "Unterstützung",
    "genus": "feminine",
    "definition": "Hilfe oder Beistand, den man jemandem gibt, um ihn zu fördern oder zu stärken.",
    "pronunciation": "/ʊntɐˈʃtʏʦʊŋ/",
    "etymology": {
      "explanation": {
        "sourceText": "Das deutsche Substantiv „Unterstützung“ leitet sich vom Verb „unterstützen“ ab, das aus dem Mittelhochdeutschen stammt und wörtlich ‚unterstützen, stützen‘ bedeutet, zusammengesetzt aus ‚unter‘ und ‚stützen‘.",
        "targetText": "Substantivul german „Unterstützung“ derivă din verbul „unterstützen“, care provine din germana medie și înseamnă literal „a susține de jos“, compus din „unter“ (sub) și „stützen“ (a sprijini)."
      },
      "source": "Etymologische Wörterbücher, Sprachhistorische Analysen"
    }
  },
  "target": {
    "lang": "ro",
    "headword": "sprijin",
    "genus": "neuter",
    "definition": "Ajutor sau susținere oferită cuiva pentru a-l întări sau a-l ajuta.",
    "pronunciation": "/spridʒin/",
    "etymology": {
      "explanation": {
        "sourceText": "„sprijin“ ist vom Verb „a sprijini“ abgeleitet, das slawischen Ursprungs ist (aus „*sŭprěgnǫti“, stützen).",
        "targetText": "Substantivul „sprijin” este format de la verbul „a sprijini”, de origine slavă, din „*sŭprěgnǫti” („a propti, a susține”)."
      },
      "source": "Etymological Dictionaries, Linguistic Analysis"
    }
  },
  "senses": [],
  "relatedWords": [
    {
      "sourceText": "Beistand",
      "targetText": "asistență"
    },
    {
      "sourceText": "Förderung",
      "targetText": "promovare"
    },
    {
      "sourceText": "helfen",
      "targetText": "a ajuta"
    },
    {
      "sourceText": "Hilfe",
      "targetText": "ajutor"
    }
  ],
  "antonyms": [
    {
      "sourceText": "Ablehnung",
      "targetText": "refuz"
    },
    {
      "sourceText": "Widerstand",
      "targetText": "rezistență"
    }
  ],
  "examples": [
    {
      "sourceText": "Die Unterstützung der Familie ist sehr wichtig in schwierigen Zeiten.",
      "targetText": "Sprijinul familiei este foarte important în vremuri dificile."
    },
    {
      "sourceText": "Er erhielt finanzielle Unterstützung vom Staat.",
      "targetText": "A primit sprijin financiar de la stat."
    },
    {
      "sourceText": "Ohne Unterstützung kann man viele Aufgaben nicht bewältigen.",
      "targetText": "Fără sprijin, multe sarcini nu pot fi îndeplinite."
    },
    {
      "sourceText": "Die Organisation bietet Unterstützung für Menschen in Not.",
      "targetText": "Organizația oferă sprijin pentru persoanele aflate în nevoie."
    }
  ],
  "learningTips": [
    {
      "lang": "de",
      "text": "Das deutsche ‚Unterstützung‘ hat ‚stützen‘ im Kern, und ‚sprijin‘ bedeutet auch ‚Stütze‘ – beide Wörter vermitteln das Bild von Halt und Hilfe."
    },
    {
      "lang": "de",
      "text": "Das rumänische Wort „sprijin“ klingt wie „spring“ mit einem ‚j‘ – stell dir vor, du springst hoch, weil du guten Sprijin (Unterstützung) hast."
    },
    {
      "lang": "de",
      "text": "Erinnere dich an das lateinische ‚supportare‘, das ‚tragen‘ bedeutet – sprijin hilft dir, etwas zu tragen oder zu stützen."
    },
    {
      "lang": "de",
      "text": "Wenn du jemanden ‚sprijini‘, dann bist du wie ein ‚Stützpfeiler‘ – das hilft dir, das Wort zu behalten."
    }
  ],
  "media": {
    "images": [],
    "audio": []
  }
}
