{
  "id": "ms-en-ro-podcast",
  "parent": "ms-ro-podcast-d7e805bd@d405953d22ecf8afd3a71499b71b1440",
  "part_of_speech": "noun",
  "tags": [
    "level:b1",
    "etymology:english",
    "topic:leisure-culture",
    "register:neutral",
    "property:concrete"
  ],
  "sourceLanguage": "en",
  "targetLanguage": "ro",
  "metadata": {
    "author": "mschwehl",
    "source": "swipedict-en-ro",
    "contentVersion": 1,
    "schemaVersion": "1.0"
  },
  "source": {
    "lang": "en",
    "headword": "podcast",
    "genus": "masculine",
    "definition": "A series of digital audio or video files made available on the internet, often available for subscription.",
    "pronunciation": "/ˈpɒdkæst/",
    "etymology": {
      "explanation": {
        "sourceText": "The word “podcast” was coined in the early 2000s as a blend of “iPod” (Apple’s portable music player) and “broadcast” (radio transmission).",
        "targetText": "Cuvântul „Podcast” a apărut la începutul anilor 2000 ca o combinație între „iPod” (playerul portabil de muzică de la Apple) și „Broadcast” (radiodifuziune)."
      },
      "source": "Etymological Dictionaries, Linguistic Analysis"
    }
  },
  "target": {
    "lang": "ro",
    "headword": "podcast",
    "genus": "neuter",
    "definition": "O serie de fișiere audio sau video digitale, publicate pe internet și de obicei disponibile prin abonament.",
    "pronunciation": "/ˈpod.kast/",
    "etymology": {
      "explanation": {
        "sourceText": "The Romanian term “podcast” is a direct borrowing from English, retaining the original form and meaning related to the combination of “iPod” and “broadcast”.",
        "targetText": "Termenul românesc „podcast” este un împrumut direct din limba engleză, păstrând forma și sensul original, legat de combinația dintre „iPod” și „broadcast”."
      },
      "source": "Etymological Dictionaries, Linguistic Analysis"
    }
  },
  "senses": [],
  "relatedWords": [
    {
      "sourceText": "Audio",
      "targetText": "audio"
    },
    {
      "sourceText": "Radio",
      "targetText": "radio"
    },
    {
      "sourceText": "Broadcast",
      "targetText": "emisiune"
    },
    {
      "sourceText": "Streaming",
      "targetText": "streaming"
    }
  ],
  "antonyms": [],
  "examples": [
    {
      "sourceText": "I listen to a podcast every morning at breakfast.",
      "targetText": "Ascult un podcast în fiecare dimineață la micul dejun."
    },
    {
      "sourceText": "The podcast covers topics related to technology and science.",
      "targetText": "Podcastul tratează subiecte legate de tehnologie și știință."
    },
    {
      "sourceText": "Many podcasts are free and can be downloaded anytime.",
      "targetText": "Multe podcasturi sunt gratuite și pot fi descărcate oricând."
    },
    {
      "sourceText": "She started her own podcast to talk about books.",
      "targetText": "Ea a început propriul podcast pentru a vorbi despre cărți."
    }
  ],
  "learningTips": [
    {
      "lang": "en",
      "text": "Remember that “cast” in podcast means to send or broadcast, which helps you understand it as a digital show."
    },
    {
      "lang": "en",
      "text": "Think of “pod” as a small container and “cast” as throwing—imagine throwing little audio containers into the internet."
    },
    {
      "lang": "en",
      "text": "Since “podcast” is an English loanword in Romanian, it keeps the same form and meaning, making it easy to remember."
    },
    {
      "lang": "en",
      "text": "Connect “podcast” with your favorite internet broadcast to recall the blend of “iPod” and “broadcast.”"
    }
  ],
  "media": {
    "images": [],
    "audio": []
  }
}