{
  "id": "ms-de-ro-marktplatz",
  "parent": "ms-ro-piata-00f4946c@e0bb728efc349e23e3890bbfa89ee6be",
  "part_of_speech": "noun",
  "tags": [
    "level:b1",
    "etymology:italian",
    "topic:places-geography",
    "register:neutral",
    "property:concrete"
  ],
  "sourceLanguage": "de",
  "targetLanguage": "ro",
  "metadata": {
    "author": "mschwehl",
    "source": "swipedict-de-ro",
    "contentVersion": 3,
    "schemaVersion": "1.0"
  },
  "source": {
    "lang": "de",
    "headword": "Marktplatz",
    "genus": "masculine",
    "definition": "Ein zentraler Platz in einer Stadt oder Gemeinde, auf dem Waren verkauft und Märkte abgehalten werden.",
    "pronunciation": "/ˈmaʁktplats/",
    "etymology": {
      "explanation": {
        "sourceText": "Das deutsche Wort „Marktplatz“ setzt sich aus „Markt“ und „Platz“ zusammen. „Markt“ stammt vom althochdeutschen 'marh' ab, das auf das lateinische 'mercatus' (Handel, Markt) zurückgeht.",
        "targetText": "Cuvântul german „Marktplatz“ este compus din „Markt” și „Platz”. „Markt” provine din germana veche înaltă 'marh', care la rândul său derivă din latinul 'mercatus' (piață, comerț)."
      },
      "source": "Etymological Dictionaries, Linguistic Analysis"
    }
  },
  "target": {
    "lang": "ro",
    "headword": "piață",
    "genus": "feminine",
    "definition": "Un loc central într-un oraș sau sat unde se vând produse și se țin târguri.",
    "pronunciation": "/ˈpi.a.t͡sə/",
    "etymology": {
      "explanation": {
        "sourceText": "Das rumänische Wort „piață“ stammt vom lateinischen 'platea' ab, das ursprünglich 'breite Straße' oder 'Platz' bedeutete und im Mittelalter die Bedeutung 'Marktplatz' annahm. Ins Rumänische kam das Wort über das Italienische, aus „piazza“.",
        "targetText": "Cuvântul românesc „piață” provine din latinul 'platea', care inițial însemna 'stradă lată' sau 'piață' și a căpătat în Evul Mediu sensul de 'târg' sau 'piață de desfacere'. Cuvântul a intrat în română pe filieră italiană, din „piazza”."
      },
      "source": "Etymological Dictionaries, Linguistic Analysis"
    }
  },
  "senses": [],
  "relatedWords": [
    {
      "sourceText": "Basar",
      "targetText": "bazar"
    },
    {
      "sourceText": "Handel",
      "targetText": "comerț"
    },
    {
      "sourceText": "Markt",
      "targetText": "târg"
    },
    {
      "sourceText": "Stadtplatz",
      "targetText": "piața orașului"
    }
  ],
  "antonyms": [],
  "examples": [
    {
      "sourceText": "Der Marktplatz ist jeden Samstag voller Stände und Besucher.",
      "targetText": "Piața este plină de tarabe și vizitatori în fiecare sâmbătă."
    },
    {
      "sourceText": "Wir treffen uns am Marktplatz vor dem Rathaus.",
      "targetText": "Ne întâlnim în piață, în fața primăriei."
    },
    {
      "sourceText": "Früher war der Marktplatz der wichtigste Ort für Handel und soziale Treffen.",
      "targetText": "În trecut, piața era cel mai important loc pentru comerț și întâlniri sociale."
    },
    {
      "sourceText": "Auf dem Marktplatz gibt es frisches Obst und Gemüse zu kaufen.",
      "targetText": "În piață se pot cumpăra fructe și legume proaspete."
    }
  ],
  "learningTips": [
    {
      "lang": "de",
      "text": "Das lateinische Wort „platea“ bedeutet ursprünglich ‚breite Straße‘, was du dir als großen offenen Platz vorstellen kannst, genau wie ein Marktplatz."
    },
    {
      "lang": "de",
      "text": "Das rumänische Wort „piață“ klingt ähnlich wie das deutsche Wort „Platz“, was dir hilft, die Bedeutung als zentraler Ort zu merken."
    },
    {
      "lang": "de",
      "text": "Merke dir: „Markt“ und „Piață“ sind beides zentrale Orte für Handel – das gemeinsame Thema hilft dir, die Wörter leichter zu behalten."
    },
    {
      "lang": "de",
      "text": "Stell dir vor, du gehst auf eine „PIAȚĂ“ und siehst viele bunte Stände – das hilft dir, das Wort mit einem lebendigen Marktplatz zu verbinden."
    }
  ],
  "media": {
    "images": [],
    "audio": []
  }
}
