{
  "id": "ms-de-ro-ungepflegt",
  "parent": "ms-ro-neingrijit-0159874c@19f99217da8fd074d241b851877560b7",
  "part_of_speech": "adjective",
  "tags": [
    "level:b2",
    "etymology:latin",
    "topic:emotions-character",
    "register:neutral",
    "property:quality"
  ],
  "sourceLanguage": "de",
  "targetLanguage": "ro",
  "metadata": {
    "author": "mschwehl",
    "source": "swipedict-de-ro",
    "contentVersion": 1,
    "schemaVersion": "1.0"
  },
  "source": {
    "lang": "de",
    "headword": "ungepflegt",
    "definition": "Beschreibt einen Zustand, in dem jemand oder etwas nicht ordentlich, sauber oder sorgfältig behandelt oder gepflegt wird.",
    "pronunciation": "/ʊnɡəˈpfleːkt/",
    "etymology": {
      "explanation": {
        "sourceText": "Das deutsche Adjektiv „ungepflegt“ setzt sich aus dem Präfix 'un-' und dem Partizip 'gepflegt' zusammen, wobei 'pflegen' vom mittelhochdeutschen 'pflegen' stammt und 'sorgen für' bedeutet.",
        "targetText": "Adjectivul german „ungepflegt” este format din prefixul 'un-' și participiul 'gepflegt', unde 'pflegen' provine din germana mijlocie 'pflegen', însemnând 'a avea grijă de'."
      },
      "source": "Etymologische Wörterbücher Deutsch"
    }
  },
  "target": {
    "lang": "ro",
    "headword": "neîngrijit",
    "definition": "Descrie o stare în care cineva sau ceva nu este curat, ordonat sau tratat cu grijă.",
    "pronunciation": "/neɨnˈɡri.dʒit/",
    "etymology": {
      "explanation": {
        "sourceText": "Das rumänische Adjektiv „neîngrijit“ stammt vom lateinischen Verb 'in + cura' ab, wobei 'îngriji' bedeutet 'sich kümmern um' und die Negation 'ne-' hinzufügt, um das Gegenteil auszudrücken.",
        "targetText": "Adjectivul românesc „neîngrijit” derivă din verbul latin compus 'in + cura', unde 'îngriji' înseamnă 'a avea grijă de', iar prefixul negativ 'ne-' exprimă opusul."
      },
      "source": "Dicționar etimologic român"
    }
  },
  "senses": [],
  "relatedWords": [
    {
      "sourceText": "ordentlich",
      "targetText": "ordonat"
    },
    {
      "sourceText": "Pflege",
      "targetText": "îngrijire"
    },
    {
      "sourceText": "sauber",
      "targetText": "curat"
    },
    {
      "sourceText": "vernachlässigt",
      "targetText": "neglijat"
    }
  ],
  "antonyms": [
    {
      "sourceText": "gepflegt",
      "targetText": "îngrijit"
    }
  ],
  "examples": [
    {
      "sourceText": "Er sieht ungepflegt aus, weil er seit Tagen nicht geduscht hat.",
      "targetText": "Arată neîngrijit pentru că nu s-a spălat de câteva zile."
    },
    {
      "sourceText": "Die ungepflegte Wohnung braucht dringend eine Reinigung.",
      "targetText": "Apartamentul neîngrijit are nevoie urgentă de curățenie."
    },
    {
      "sourceText": "Ungepflegte Kleidung kann einen schlechten Eindruck machen.",
      "targetText": "Hainele neîngrijite pot lăsa o impresie proastă."
    },
    {
      "sourceText": "Sie wirkte ungepflegt und müde nach der langen Reise.",
      "targetText": "Părea neîngrijită și obosită după călătoria lungă."
    }
  ],
  "learningTips": [
    {
      "lang": "de",
      "text": "Das rumänische 'neîngrijit' beginnt mit 'ne-', das ist wie das deutsche 'un-' für das Gegenteil, und 'îngrijit' klingt ähnlich wie 'ingriji' (kümmern), also 'nicht kümmern' = 'neîngrijit'."
    },
    {
      "lang": "de",
      "text": "Das Wort 'îngrijit' enthält 'grijă', was 'Sorge' bedeutet. 'Neîngrijit' heißt also 'ohne Sorge' oder 'ohne Pflege'."
    },
    {
      "lang": "de",
      "text": "Merke dir die Ähnlichkeit zwischen 'pflege' und 'îngrijire' – beide bedeuten 'Pflege' bzw. 'Fürsorge'. Das hilft, 'neîngrijit' als Gegenteil von 'gepflegt' zu verstehen."
    },
    {
      "lang": "de",
      "text": "Stell dir vor, jemand 'kümmert' sich (îngriji) um eine Pflanze. Wenn er das nicht tut, wird sie 'neîngrijit' – also ungepflegt."
    }
  ],
  "media": {
    "images": [],
    "audio": []
  }
}