{
  "id": "ms-en-ro-entry-fee",
  "parent": "ms-ro-bilet-de-intrare-cdcc972f@21500a1cff8ff2a81e5db1406b97d57f",
  "part_of_speech": "noun",
  "tags": [
    "level:a2",
    "etymology:french",
    "topic:leisure-culture",
    "register:neutral",
    "property:concrete"
  ],
  "sourceLanguage": "en",
  "targetLanguage": "ro",
  "metadata": {
    "author": "mschwehl",
    "source": "swipedict-en-ro",
    "contentVersion": 1,
    "schemaVersion": "1.0"
  },
  "source": {
    "lang": "en",
    "headword": "entry fee",
    "genus": "masculine",
    "definition": "A charge or payment required to gain access to a place or event.",
    "pronunciation": "/ˈɛntri fiː/",
    "etymology": {
      "explanation": {
        "sourceText": "The English term 'entry fee' combines 'entry', from Old French 'entrée' meaning 'a going in', and 'fee', from Old French 'fée', meaning a payment or reward.",
        "targetText": "Cuvântul englezesc „entry fee” combină „entry”, din franceza veche „entrée” care înseamnă „a intra”, și „fee”, din franceza veche „fée”, care înseamnă o plată sau recompensă."
      },
      "source": "Etymological dictionaries, linguistic research"
    },
    "additional": "null"
  },
  "target": {
    "lang": "ro",
    "headword": "bilet de intrare",
    "genus": "neuter",
    "definition": "Taxa sau prețul plătit pentru a avea acces la un loc sau eveniment.",
    "pronunciation": "/ˈbi.let de inˈtra.re/",
    "etymology": {
      "explanation": {
        "sourceText": "The Romanian expression „bilet de intrare” consists of 'bilet', borrowed from French 'billet' (originally 'small piece of paper'), and 'intrare', derived from Latin 'intrare', meaning 'to enter'.",
        "targetText": "Expresia românească „bilet de intrare” este formată din 'bilet', împrumutat din franceza 'billet' (inițial 'bucată mică de hârtie'), și 'intrare', derivat din latină 'intrare', care înseamnă 'a intra'."
      },
      "source": "Dicționare etimologice, studii lingvistice"
    }
  },
  "senses": [],
  "relatedWords": [
    {
      "sourceText": "entry ticket",
      "targetText": "bilet de intrare"
    },
    {
      "sourceText": "fee",
      "targetText": "taxă"
    },
    {
      "sourceText": "event",
      "targetText": "eveniment"
    },
    {
      "sourceText": "access",
      "targetText": "acces"
    }
  ],
  "antonyms": [
    {
      "sourceText": "exit",
      "targetText": "ieșire"
    }
  ],
  "examples": [
    {
      "sourceText": "The entry fee is five euros.",
      "targetText": "Biletul de intrare costă cinci euro."
    },
    {
      "sourceText": "Please show your entry fee ticket.",
      "targetText": "Vă rugăm să prezentați biletul de intrare."
    },
    {
      "sourceText": "Entry is free for children.",
      "targetText": "Intrarea este gratuită pentru copii."
    },
    {
      "sourceText": "No access without an entry ticket.",
      "targetText": "Fără bilet de intrare nu este permis accesul."
    }
  ],
  "learningTips": [
    {
      "lang": "en",
      "text": "Remember 'entry fee' as the cost you pay to 'enter' a place or event—'entry' means going in, and 'fee' means payment."
    },
    {
      "lang": "en",
      "text": "The Romanian word 'intrare' sounds like 'entrance' in English, both related to going inside."
    },
    {
      "lang": "en",
      "text": "Think of 'bilet' as similar to the English 'billet' or 'ticket'—a small paper that grants access."
    },
    {
      "lang": "en",
      "text": "To remember 'bilet de intrare', imagine buying a 'ticket' ('bilet') to 'enter' ('intrare') a concert or museum."
    }
  ],
  "media": {
    "images": [],
    "audio": []
  }
}