{
  "id": "ms-de-ro-hemd",
  "parent": "ms-ro-camasa-fa52d0ec@e37f481ca054f6416e504023521ba219",
  "part_of_speech": "noun",
  "tags": [
    "level:a1",
    "etymology:latin",
    "topic:objects-clothing",
    "register:neutral",
    "property:concrete"
  ],
  "sourceLanguage": "de",
  "targetLanguage": "ro",
  "metadata": {
    "author": "mschwehl",
    "source": "swipedict-de-ro",
    "contentVersion": 1,
    "schemaVersion": "1.0"
  },
  "source": {
    "lang": "de",
    "headword": "Hemd",
    "genus": "neuter",
    "definition": "Ein Kleidungsstück, das den Oberkörper bedeckt, meist mit Knöpfen vorne und Kragen.",
    "pronunciation": "/hɛmt/",
    "etymology": {
      "explanation": {
        "sourceText": "Das deutsche Wort „Hemd“ stammt vom althochdeutschen 'hemed' ab, das auf das urgermanische *hamitho zurückgeht und ursprünglich ein einfaches Kleidungsstück bezeichnete.",
        "targetText": "Cuvântul german „Hemd” provine din vechiul german înalt 'hemed', derivat din rădăcina urgermanică *hamitho, care desemna inițial o haină simplă."
      },
      "source": "Etymological Dictionaries, Linguistic Analysis"
    }
  },
  "target": {
    "lang": "ro",
    "headword": "cămașă",
    "genus": "feminine",
    "definition": "Un articol de îmbrăcăminte care acoperă partea superioară a corpului, de obicei cu nasturi în față și guler.",
    "pronunciation": "/kəˈmɨʃə/",
    "etymology": {
      "explanation": {
        "sourceText": "Das rumänische Wort „cămașă“ stammt vom lateinischen 'camisia' ab, das ein einfaches Hemd oder Unterhemd bezeichnete und aus dem Galloromanischen übernommen wurde.",
        "targetText": "Cuvântul românesc „cămașă” provine din latină, din 'camisia', care desemna o cămașă simplă sau un tricou, preluat din gallo-romanică."
      },
      "source": "Etymological Dictionaries, Linguistic Analysis"
    }
  },
  "senses": [],
  "relatedWords": [
    {
      "sourceText": "Bluse",
      "targetText": "bluză"
    },
    {
      "sourceText": "Hose",
      "targetText": "pantaloni"
    },
    {
      "sourceText": "Jacke",
      "targetText": "jachetă"
    },
    {
      "sourceText": "Kragen",
      "targetText": "guler"
    }
  ],
  "antonyms": [],
  "examples": [
    {
      "sourceText": "Das Hemd ist aus Baumwolle.",
      "targetText": "Cămașa este din bumbac."
    },
    {
      "sourceText": "Er trägt ein weißes Hemd zur Arbeit.",
      "targetText": "El poartă o cămașă albă la serviciu."
    },
    {
      "sourceText": "Das Hemd hat lange Ärmel.",
      "targetText": "Cămașa are mâneci lungi."
    },
    {
      "sourceText": "Ich habe mein Hemd gebügelt.",
      "targetText": "Mi-am călcat cămașa."
    }
  ],
  "learningTips": [
    {
      "lang": "de",
      "text": "Das „ș“ in „cămașă“ klingt wie „sch“ im Deutschen, also sprich es wie „kamaschä“ aus."
    },
    {
      "lang": "de",
      "text": "Das rumänische Wort „cămașă“ klingt ähnlich wie das französische „chemise“, was ebenfalls Hemd bedeutet. So kannst du es dir leicht merken."
    },
    {
      "lang": "de",
      "text": "Das Wort „Hemd“ und „cămașă“ sind beide alt und stammen aus dem Lateinischen, was dir hilft, die Verbindung zu verstehen."
    },
    {
      "lang": "de",
      "text": "Stell dir vor, du trägst eine „KAMAS“ (Kamasutra) Pose in deinem Hemd – das hilft dir, das Wort „cămașă“ zu behalten."
    }
  ],
  "media": {
    "images": [],
    "audio": []
  }
}