{
  "id": "ms-en-ro-compliment",
  "parent": "ms-ro-compliment-3d54f335@f0e35ab9e57f77c437401cb19fe90003",
  "part_of_speech": "noun",
  "tags": [
    "level:b1",
    "etymology:latin",
    "topic:people-society",
    "register:neutral",
    "property:abstract"
  ],
  "sourceLanguage": "en",
  "targetLanguage": "ro",
  "metadata": {
    "author": "mschwehl",
    "source": "swipedict-en-ro",
    "contentVersion": 1,
    "schemaVersion": "1.0"
  },
  "source": {
    "lang": "en",
    "headword": "compliment",
    "genus": "neuter",
    "definition": "A polite expression of praise or admiration that shows respect or appreciation to someone.",
    "pronunciation": "/ˈkɒmplɪmənt/",
    "etymology": {
      "explanation": {
        "sourceText": "The English word 'compliment' comes from the Italian 'complimento', which itself derives from the Latin 'complēmentum', meaning 'completion' or 'filling up'.",
        "targetText": "Cuvântul englezesc „compliment” provine din italianul 'complimento', care la rândul său derivă din latinul 'complēmentum', însemnând 'completare' sau 'întregire'."
      },
      "source": "Etymological Dictionaries, Linguistic Analysis"
    },
    "additional": "null"
  },
  "target": {
    "lang": "ro",
    "headword": "compliment",
    "genus": "neuter",
    "definition": "O expresie politicoasă sau admirativă prin care cineva arată respect sau apreciere față de altcineva.",
    "pronunciation": "/kompliˈment/",
    "etymology": {
      "explanation": {
        "sourceText": "The Romanian word 'compliment' was borrowed from the French 'compliment', which comes from the Latin 'complēmentum' originally meaning 'completion'.",
        "targetText": "Cuvântul românesc „compliment” este împrumutat din franceza 'compliment', care provine din latinul 'complēmentum', inițial cu sensul de 'completare'."
      },
      "source": "Etymological Dictionaries, Linguistic Analysis"
    }
  },
  "senses": [],
  "relatedWords": [
    {
      "sourceText": "recognition",
      "targetText": "recunoaștere"
    },
    {
      "sourceText": "admiration",
      "targetText": "admirare"
    },
    {
      "sourceText": "politeness",
      "targetText": "politete"
    },
    {
      "sourceText": "praise",
      "targetText": "laudă"
    }
  ],
  "antonyms": [
    {
      "sourceText": "criticism",
      "targetText": "critică"
    }
  ],
  "examples": [
    {
      "sourceText": "He gave her a compliment on her beautiful dress.",
      "targetText": "I-a făcut un compliment pentru rochia frumoasă."
    },
    {
      "sourceText": "An honest compliment can boost self-confidence.",
      "targetText": "Un compliment sincer poate întări încrederea în sine."
    },
    {
      "sourceText": "She received many compliments for her work.",
      "targetText": "A primit multe complimente pentru munca ei."
    },
    {
      "sourceText": "One should always mean compliments sincerely.",
      "targetText": "Trebuie să fii întotdeauna sincer când faci complimente."
    }
  ],
  "learningTips": [
    {
      "lang": "en",
      "text": "The Romanian word 'compliment' sounds almost the same as in English, making it easy to remember and recognize."
    },
    {
      "lang": "en",
      "text": "Think of 'compliment' as a polite way to 'complete' someone's day with kind words, linking it to its Latin root 'complēmentum'."
    },
    {
      "lang": "en",
      "text": "Since 'compliment' is a direct borrowing from French and English, it’s a familiar word that helps you express praise politely in Romanian."
    },
    {
      "lang": "en",
      "text": "Remember that giving a 'compliment' is like giving a little gift of kindness—both words start with 'com-', making them easy to connect."
    }
  ],
  "media": {
    "images": [],
    "audio": []
  }
}