{
  "id": "ms-en-ro-nature",
  "parent": "ms-ro-natura-150946ca@e90b8caa4e1a0f3676d3cfd8cd522409",
  "part_of_speech": "noun",
  "tags": [
    "level:a1",
    "etymology:latin",
    "topic:nature-environment",
    "register:neutral",
    "property:abstract"
  ],
  "sourceLanguage": "en",
  "targetLanguage": "ro",
  "metadata": {
    "author": "mschwehl",
    "source": "swipedict-en-ro",
    "contentVersion": 1,
    "schemaVersion": "1.0"
  },
  "source": {
    "lang": "en",
    "headword": "nature",
    "genus": "feminine",
    "definition": "The natural world including plants, animals, landscapes, and other features and products of the earth, not created by humans.",
    "pronunciation": "/ˈneɪtʃər/",
    "etymology": {
      "explanation": {
        "sourceText": "The word 'nature' comes from the Latin 'natura', meaning 'birth, character, or the inherent qualities of something'.",
        "targetText": "Cuvântul „Natur“ provine din latină „natura“, care înseamnă „naștere, esență sau natură“."
      },
      "source": "Etymological Dictionaries, Linguistic Analysis"
    },
    "additional": "Nature encompasses plants, animals, and all living organisms."
  },
  "target": {
    "lang": "ro",
    "headword": "natură",
    "genus": "feminine",
    "definition": "totalitatea plantelor, animalelor și lucrurilor neînsuflețite de pe Pământ",
    "pronunciation": "/naˈturə/",
    "etymology": {
      "explanation": {
        "sourceText": "The Romanian word 'natură' derives from the Latin 'natura' and refers to the essence of things and the environment.",
        "targetText": "Cuvântul românesc „natură“ provine din latină „natura“ și desemnează esența lucrurilor și mediul înconjurător."
      },
      "source": "Etymological Dictionaries, Linguistic Analysis"
    },
    "additional": "„Natură“ is often used to describe aspects of life in harmony with the environment."
  },
  "senses": [
    {
      "gloss": "Ecology",
      "explanation": {
        "sourceText": "In ecology, 'nature' refers to the interacting systems within the environment.",
        "targetText": "În ecologie, „natură“ se referă la sistemele care interacționează în mediu."
      },
      "examples": [
        {
          "sourceText": "Nature is a delicate balance.",
          "targetText": "Natura este un echilibru delicat."
        }
      ]
    },
    {
      "gloss": "Creation",
      "explanation": {
        "sourceText": "In a spiritual or philosophical context, 'nature' denotes creation.",
        "targetText": "În context spiritual sau filozofic, „natură“ desemnează creația."
      },
      "examples": [
        {
          "sourceText": "Nature is a wonder of creation.",
          "targetText": "Natura este o minune a creației."
        }
      ]
    }
  ],
  "relatedWords": [
    {
      "sourceText": "deliver",
      "targetText": "a preda"
    },
    {
      "sourceText": "spend",
      "targetText": "a cheltui"
    },
    {
      "sourceText": "supply",
      "targetText": "a livra"
    },
    {
      "sourceText": "hand over",
      "targetText": "a înmâna"
    }
  ],
  "antonyms": [
    {
      "sourceText": "take",
      "targetText": "a lua"
    }
  ],
  "examples": [
    {
      "sourceText": "I love nature.",
      "targetText": "Îmi place natura."
    },
    {
      "sourceText": "Nature is beautiful in spring.",
      "targetText": "Natura este minunată primăvara."
    },
    {
      "sourceText": "We should protect nature.",
      "targetText": "Ar trebui să protejăm natura."
    },
    {
      "sourceText": "You find peace in nature.",
      "targetText": "În natură se găsește liniște."
    },
    {
      "sourceText": "The meadows are full of beautiful flowers in nature.",
      "targetText": "Pajiștile sunt pline de flori frumoase în natură."
    },
    {
      "sourceText": "Nature has many secrets.",
      "targetText": "Natura are multe secrete."
    }
  ],
  "learningTips": [
    {
      "lang": "en",
      "text": "Think of 'nature' as the natural 'nurture' of the earth—both start with 'n' and relate to growth and life."
    },
    {
      "lang": "en",
      "text": "The Romanian word 'natură' sounds like 'nature'—easy to remember because they share the same Latin root."
    },
    {
      "lang": "en",
      "text": "Imagine a peaceful natural scene when you hear 'natură'—this will help you connect the word to its meaning."
    },
    {
      "lang": "en",
      "text": "Remember that 'nature' includes everything from plants to animals to landscapes—'natură' covers all these in Romanian."
    }
  ],
  "media": {
    "images": [],
    "audio": []
  }
}