{
  "id": "ms-de-ro-alles-gut",
  "parent": "ms-ro-totul-bine-a7c09ffb@d04e5ec6ccd9a3ccb55c230723431e4e",
  "part_of_speech": "phrase",
  "tags": [
    "level:a1",
    "etymology:internal",
    "topic:emotions-character",
    "register:informal",
    "property:state"
  ],
  "sourceLanguage": "de",
  "targetLanguage": "ro",
  "metadata": {
    "author": "mschwehl",
    "source": "swipedict-de-ro",
    "contentVersion": 1,
    "schemaVersion": "1.0"
  },
  "source": {
    "lang": "de",
    "headword": "Alles gut",
    "definition": "Eine umgangssprachliche Wendung, die ausdrückt, dass alles in Ordnung oder kein Problem ist.",
    "pronunciation": "/ˈaləs ɡuːt/",
    "etymology": {
      "explanation": {
        "sourceText": "Die Phrase „Alles gut“ ist eine moderne, umgangssprachliche Zusammensetzung aus den Wörtern 'alles' und 'gut', die zusammen eine beruhigende oder zustimmende Bedeutung haben.",
        "targetText": "Expresia „Alles gut” este o compoziție modernă colocvială din cuvintele 'alles' și 'gut', având un sens liniștitor sau afirmativ."
      },
      "source": "Phrase Usage, Linguistic Observation"
    }
  },
  "target": {
    "lang": "ro",
    "headword": "totul bine",
    "definition": "O expresie colocvială care exprimă că totul este în regulă sau nu există probleme.",
    "pronunciation": "/toˈtul ˈbi.ne/",
    "etymology": {
      "explanation": {
        "sourceText": "Die rumänische Phrase „totul bine“ ist eine direkte Übersetzung aus dem Deutschen und entstand intern durch Kombination der Wörter 'totul' (alles) und 'bine' (gut).",
        "targetText": "Expresia românească „totul bine” este o traducere directă din germană, formată intern prin combinarea cuvintelor 'totul' (tot) și 'bine' (bine)."
      },
      "source": "Phrase Usage, Linguistic Observation"
    }
  },
  "senses": [],
  "relatedWords": [
    {
      "sourceText": "Alles klar",
      "targetText": "totul clar"
    },
    {
      "sourceText": "Gut",
      "targetText": "bine"
    },
    {
      "sourceText": "In Ordnung",
      "targetText": "în regulă"
    },
    {
      "sourceText": "Kein Problem",
      "targetText": "nicio problemă"
    }
  ],
  "antonyms": [],
  "examples": [
    {
      "sourceText": "Alles gut, ich habe keine Eile.",
      "targetText": "Totul bine, nu mă grăbesc."
    },
    {
      "sourceText": "Mach dir keine Sorgen, alles gut!",
      "targetText": "Nu-ți face griji, totul bine!"
    },
    {
      "sourceText": "Alles gut, wir schaffen das schon.",
      "targetText": "Totul bine, o să reușim."
    },
    {
      "sourceText": "Alles gut, danke der Nachfrage.",
      "targetText": "Totul bine, mulțumesc că întrebi."
    }
  ],
  "learningTips": [
    {
      "lang": "de",
      "text": "Die Phrase ist informell und freundlich – perfekt, um in Gesprächen locker zu bleiben."
    },
    {
      "lang": "de",
      "text": "Die Wörter 'alles' und 'totul' bedeuten beide 'alles', und 'gut' und 'bine' bedeuten 'gut' – so kannst du die Phrase leicht übersetzen."
    },
    {
      "lang": "de",
      "text": "Nutze 'totul bine' im Alltag, um entspannt zu antworten, wenn jemand fragt, ob alles in Ordnung ist."
    },
    {
      "lang": "de",
      "text": "Stell dir vor, du sagst 'Alles gut' wie ein beruhigendes Mantra, das auch im Rumänischen als 'totul bine' funktioniert."
    }
  ],
  "media": {
    "images": [],
    "audio": []
  }
}