{
  "id": "ms-de-ro-gruen",
  "parent": "ms-ro-verde-d7746209@a950f4e887e890859988fd1de8d2692a",
  "part_of_speech": "adjective",
  "tags": [
    "level:a1",
    "etymology:latin",
    "topic:nature-environment",
    "register:neutral",
    "property:quality"
  ],
  "sourceLanguage": "de",
  "targetLanguage": "ro",
  "metadata": {
    "author": "mschwehl",
    "source": "swipedict-de-ro",
    "contentVersion": 1,
    "schemaVersion": "1.0"
  },
  "source": {
    "lang": "de",
    "headword": "grün",
    "definition": "Beschreibt die Farbe, die an frisches Gras oder Blätter erinnert.",
    "pronunciation": "/ɡʁyːn/",
    "etymology": {
      "explanation": {
        "sourceText": "Das deutsche Adjektiv „grün“ stammt vom althochdeutschen 'gruoen' ab, das auf eine urgermanische Wurzel *grōn- zurückgeht, die mit dem englischen 'green' verwandt ist und die Farbe Grün bezeichnet.",
        "targetText": "Adjectivul german „grün” provine din vechiul german înalt 'gruoen', derivat din rădăcina urgermanică *grōn-, înrudită cu englezescul 'green', desemnând culoarea verde."
      },
      "source": "Etymological Dictionaries, Linguistic Analysis"
    }
  },
  "target": {
    "lang": "ro",
    "headword": "verde",
    "definition": "Descrie culoarea care amintește de iarba proaspătă sau frunze.",
    "pronunciation": "/ˈverde/",
    "etymology": {
      "explanation": {
        "sourceText": "Das rumänische Adjektiv „verde“ stammt vom lateinischen Wort 'viridis' ab, das 'grün' bedeutet. Es hat sich im Rumänischen zu 'verde' entwickelt und bezeichnet die Farbe Grün.",
        "targetText": "Adjectivul românesc „verde” provine din cuvântul latin 'viridis', care înseamnă 'verde'. În limba română, s-a păstrat sensul culorii verzi."
      },
      "source": "Etymological Dictionaries, Linguistic Analysis"
    }
  },
  "senses": [],
  "relatedWords": [
    {
      "sourceText": "Baum",
      "targetText": "copac"
    },
    {
      "sourceText": "Blatt",
      "targetText": "frunză"
    },
    {
      "sourceText": "Frühling",
      "targetText": "primăvară"
    },
    {
      "sourceText": "Natur",
      "targetText": "natură"
    }
  ],
  "antonyms": [
    {
      "sourceText": "rot",
      "targetText": "roșu"
    }
  ],
  "examples": [
    {
      "sourceText": "Der Baum hat grüne Blätter.",
      "targetText": "Copacul are frunze verzi."
    },
    {
      "sourceText": "Das Gras ist im Frühling grün.",
      "targetText": "Iarba este verde primăvara."
    },
    {
      "sourceText": "Ich mag grüne Äpfel.",
      "targetText": "Îmi plac merele verzi."
    },
    {
      "sourceText": "Die Ampel zeigt grün.",
      "targetText": "Semaforul arată verde."
    }
  ],
  "learningTips": [
    {
      "lang": "de",
      "text": "Das deutsche 'grün' und das rumänische 'verde' stammen beide aus indogermanischen Wurzeln, die mit Natur und Leben verbunden sind."
    },
    {
      "lang": "de",
      "text": "Das rumänische 'verde' klingt ähnlich wie das englische 'verdant', was grün bedeutet. So kannst du dir die Farbe leicht merken."
    },
    {
      "lang": "de",
      "text": "Stell dir vor, du siehst einen 'Verde'-Marktplatz voller grüner Pflanzen – so merkst du dir das Wort."
    },
    {
      "lang": "de",
      "text": "Verbinde 'grün' mit dem lateinischen Ursprung 'viridis'. Denk an 'viride' als frisches Grün in der Natur."
    }
  ],
  "media": {
    "images": [],
    "audio": []
  }
}