{
  "id": "ms-en-ro-catch",
  "parent": "ms-ro-a-prinde-06c09d69@7af8460e02f1f3bd48a7ce28626b10d9",
  "part_of_speech": "verb",
  "tags": [
    "level:a2",
    "etymology:latin",
    "topic:actions-verbs",
    "register:neutral",
    "property:action"
  ],
  "sourceLanguage": "en",
  "targetLanguage": "ro",
  "metadata": {
    "author": "mschwehl",
    "source": "swipedict-en-ro",
    "contentVersion": 1,
    "schemaVersion": "1.0"
  },
  "source": {
    "lang": "en",
    "headword": "catch",
    "definition": "to seize or grasp something, usually with the hand",
    "pronunciation": "/kætʃ/",
    "etymology": {
      "explanation": {
        "sourceText": "The English verb 'catch' originates from Old English 'ceacian', meaning 'to seize or grasp', and has evolved to its current usage of capturing or holding something.",
        "targetText": "Cuvântul englezesc „catch“ provine din engleza veche „ceacian“, care însemna „a apuca sau a prinde“, și a evoluat către sensul actual de a captura sau a ține ceva."
      },
      "source": "Etymological Dictionaries, Linguistic Analysis"
    },
    "additional": "The verb is used in many expressions, for example, 'catch a ball', and can also be used metaphorically (e.g., 'catch someone's attention')."
  },
  "target": {
    "lang": "ro",
    "headword": "a prinde",
    "definition": "a lua sau a ține ceva, de obicei cu mâna",
    "pronunciation": "/a ˈprinde/",
    "etymology": {
      "explanation": {
        "sourceText": "The Romanian verb 'a prinde' derives from the Latin 'prehendere', meaning 'to grasp, to catch'. It is commonly used in contexts involving catching or holding objects.",
        "targetText": "Verbul românesc „a prinde“ derivă din latină, din „prehendere“, care înseamnă „a apuca, a prinde“."
      },
      "source": "Etymological Dictionaries, Linguistic Analysis"
    },
    "additional": "Este folosit și în sens figurat, cum ar fi „a prinde o idee“."
  },
  "relatedWords": [
    {
      "sourceText": "catch",
      "targetText": "prindere"
    },
    {
      "sourceText": "dog",
      "targetText": "câine"
    },
    {
      "sourceText": "net",
      "targetText": "plasã"
    },
    {
      "sourceText": "game",
      "targetText": "joc"
    }
  ],
  "antonyms": [
    {
      "sourceText": "release",
      "targetText": "a desprinde"
    }
  ],
  "examples": [
    {
      "sourceText": "I catch the ball.",
      "targetText": "Eu prind mingea."
    },
    {
      "sourceText": "Do you catch the bird?",
      "targetText": "Prinzi pasărea?"
    },
    {
      "sourceText": "She catches the bottle.",
      "targetText": "Ea prinde sticla."
    },
    {
      "sourceText": "We catch the light.",
      "targetText": "Noi prindem lumina."
    },
    {
      "sourceText": "Do you catch the animal?",
      "targetText": "Prindeți animalul?"
    },
    {
      "sourceText": "They catch the backup copy.",
      "targetText": "Ei prind copia de rezervă."
    },
    {
      "sourceText": "I caught the child.",
      "targetText": "Am prins copilul."
    },
    {
      "sourceText": "He caught the first fish.",
      "targetText": "El prindea primul pește."
    },
    {
      "sourceText": "I will catch the next level.",
      "targetText": "Voi prinde următorul nivel."
    },
    {
      "sourceText": "I would catch it if I could.",
      "targetText": "Aș prinde-o dacă aș putea."
    },
    {
      "sourceText": "Catch the ball!",
      "targetText": "Prinde mingea!"
    }
  ],
  "learningTips": [
    {
      "lang": "en",
      "text": "Remember 'catch' and 'a prinde' are cognates; both involve grabbing or seizing something, like catching a ball or an idea."
    },
    {
      "lang": "en",
      "text": "Use 'a prinde' in different contexts such as sports, everyday actions, or even abstract ideas to get comfortable with it."
    },
    {
      "lang": "en",
      "text": "Practice conjugations like 'Eu prind' (I catch), 'El prinde' (he catches) to build familiarity."
    },
    {
      "lang": "en",
      "text": "Think of 'prinde' sounding like 'print'—just as a printer grabs paper, 'a prinde' means to grab or catch."
    }
  ],
  "media": {
    "images": [],
    "audio": []
  }
}